{"$schema":"http://json-schema.org/draft-07/schema#","type":"object","required":["root","reportDir","ignore","extensions","entrypoints","enableExternalTools","duplication","complexity","coupling"],"properties":{"root":{"type":"string"},"reportDir":{"type":"string"},"ignore":{"type":"array","items":{"type":"string"}},"extensions":{"type":"array","items":{"type":"string"}},"entrypoints":{"type":"array","items":{"type":"string"}},"enableExternalTools":{"type":"boolean"},"duplication":{"type":"object","required":["minLines"],"properties":{"minLines":{"type":"integer","minimum":2}}},"complexity":{"type":"object","required":["maxBranches"],"properties":{"maxBranches":{"type":"integer","minimum":1}}},"coupling":{"type":"object","required":["maxImports"],"properties":{"maxImports":{"type":"integer","minimum":1}}}}}
